10/29/2020 7:53:58,elenewu88@gmail.com,Lenny (Yilin) Wu,she/her,,"Computer Science, Applied Mathematics",No,2023,"Hack, ICPC, Teach LA",,"I hope that being an ACM intern will teach me some useful social and technical skills, so that I can make meaningful contributions to the organization in the future. I also hope that it will be a fun and rewarding experience!","This fall, I have been attending Intro to ICPC and Hack workshops at ACM. I'm also in a Hack Fam.","I work at UCLA Math Circle and LA Mentorship Program, about 6 hours total each week. Additionally, I run a food blog (which can be as involved or not-involved as I'd prefer).","I have been involved with LA Mentorship Program (previously under UCLA Regents Scholar Society), where I tutor in general subjects and run SAT/ACT test-prep workshops for students attending University High School. I also help students from lower-income families prepare for college by providing guidance throughout their essay-writing & college application process.","http://vegamelon.com/
http://instagram.com/vegamelon/ (for fun)",,"I have been enjoying the to the intro-to-CP and interview prep workshops by ICPC this quarter. Although I'm new to competitive programming and have a long way to go, I love problem solving and think I can grow a lot through ICPC. I'm also quite enthusiastic about teaching, so I hope that I'll get to teach for ICPC some day (once I become good enough)!","1. where did i put my bruincard
2. A worker is to perform work for you for seven straight days. In return for his work, you will pay him 1/7th of a bar of gold per day. The worker requires a daily payment of 1/7th of the bar of gold. What and where are the fewest number of cuts to the bar of gold that will allow you to pay him 1/7th each day?","During high school, I tutored in math / other STEM subjects for several hours a week, and I was an academic coach for a number of math classes. Currently, I tutor high school students through the Los Angeles Mentorship Program (RSS LAMP). I also started teaching as an assistant at the UCLA Math Circle (ORMC) this year."
10/29/2020 12:57:00,nathanlin710@gmail.com,Nathan Lin,he/him,,Computer Science,No,2024,"Hack, ICPC",,"I am applying to be an ACM Intern to further develop my coding experience within UCLA’s largest computer science club as well as find my own family and community of friends as a college freshman. Apart from several computer science courses and projects, I am yet to experience and participate within a large-scale computer science community. After attending the meetings and workshops from ACM, Hack, and ICPC, I have gained invaluable knowledge through languages such as C++ and Javascript, as well as being introduced to how both of these committees prepare me for industry in the real world. By being an ACM Intern, I believe this is the perfect opportunity for me to not only continue learning computer science languages and its applications but also participate in creating workshops and hackathons to embrace a higher role within computer science. In addition, as the largest CS club on campus, being an ACM Intern will help me connect with not only computer science students, but also diversify my connections with other majors and fields through each of ACM’s six committees.","Currently, I am interested in two branches of ACM's committees: Hack and ICPC. I have attended three sessions of Hackschool by ACM Hack. These sessions benefited me in getting started within my Bloom fellowship by ACM and Creative Labs to begin developing my own website. I also attended the two workshops by ICPC for Introduction to Competitive Programming, which have introduced me to preparing for future coding questions and competitions.
","Starting from May 2021, I will be interning for Cisco as a software engineer, but will mostly take place during the summer. During the school year, I am a tutor for Calculus, but my working hours are lenient. Therefore, I am committed to working with ACM this entire school year.
","During high school, I was heavily involved in the Associated Student Body of my school, serving as the Freshman Class Treasurer and Junior Class Secretary. I played a leadership role in managing our class funds through fundraisers and sponsorships, organizing and planning school events such as Homecoming and Prom, as well as implementing and creating new ideas for our school district. In addition, every summer I volunteered as a camp counselor for a Chinese cultural organization, where I organized cultural activities and learning material for young campers.
","Resume: https://docs.google.com/document/d/1L3sw4uw7U5AWELkxwkDFMEhsHDSTKHdRDkzj7K9GXTk/edit?usp=sharing
LinkedIn: 
www.linkedin.com/in/nathanlin710",,"From the first few workshops of ACM ICPC, I have discovered my passion for problem-solving, and the informational events have prepared me in applying for my first software engineering interview as a freshman. After working on technical interview questions and problem-solving, I secured a Cisco internship and will continue learning from ICPC to advance my coding abilities. I want to be a part of the ICPC committee to also develop beginner-friendly events to new members who are also passionate about competitive programming and prepare beginners into receiving their first jobs or internships.
","My favorite problem is how many permutations it take for each set of algorithms to solve a 3x3 Rubik’s cube. I find it interesting how a Rubik’s cube can be solved from just two moves if repeated just over a hundred times. In my free time, I love finding new ways of solving the cube and memorizing these algorithms.
","I have past experience as a local tutor for Bay Area high school students, where I teach subjects such as Calculus, SAT Math II, and Physics. My work as a tutor is mainly 1 one-on-one, and I have been tutoring for four years. I am also experienced coaching my own basketball team of sixth graders, where I host weekly practices and guide them in playing in monthly local tournaments."
10/29/2020 14:37:26,erictang0220@gmail.com,Eric Tang,he/him,,electrical engineering,No,2024,"AI, ICPC",,"I look forward to gaining more knowledge about machine learning and deep learning and improving my problem solving skills. I also hope to enhance my communication skill through learning, teaching, and cooperation with other officers and interns.","I go to AI advance workshops, ICPC intro sessions, coding interview crash courses, and hackschool sessions.",I am also involved in IEEE.,I've been the build team lead of my high school's robotics club for two years.,www.linkedin.com/in/erictang24,I love playing tennis:),I love the process of problem solving regardless of the correctness of solutions.,What can you keep after giving to someone? your words:),"I have tutored highschoolers in math, physics, and biology."
10/29/2020 19:36:55,joshuaskylar@g.ucla.edu,Joshua (Yuchen) Zhao,He/Him,,Math of Computation,No,2023,"AI, Cyber, Hack, ICPC",,Gain practical experience in ml and algorithm design,Workshops of ACM AI and ACM Hack,Undergrad Math Student Association,"Chinese Student Association, New Student Mentor
Undergrad Math Student Association, Member",https://www.linkedin.com/in/joshua-zhao-83a2b518b/,"Proficient in C++, R, and Python

Selected UCLA Coursework: math182 (algorithm theory), math151A (numerical methods), math131AH(hons real analysis), math115AH (hons linear algebra)",,,
10/29/2020 22:33:53,abhishek1marda@ucla.edu,Abhishek Marda,he/him,,Computer Science,No,2023,"ACM Board, Cyber, ICPC",Internal Affairs,"Most importantly I'm hoping to become part of a community. I hope to interact with people who are interested in topics similar to me and also will enjoy interacting beyond. As an ACM intern I hope to also learn a lot about the particular topics of the club that also brings a lot of technical skill development. However, more than just technical skill, it will also bring out soft skills for me, for example organizing events and/or hosting them so that I get to develop a more all round personality. This also comes with even being in a club and interacting with people! I'd like to break out of the typical introverted engineer stereotype that I currently have and develop myself. And lastly, but definitely not least, I hope to give back to the community that I would be part of during the internship and beyond, and inspire others to do the same, in a collaborative and supportive environment that I have seen ACM display.","Most of my involvement has been with ACM Cyber. Last year during freshman year I attended several of their fall and winter events including those on injection and cryptography. This year, being in a different time zone, I ended up relying more on the YouTube videos on the ACM channel, but I did attend the general meeting live.","As of now, I'm part of one other club. I have no other commitments.","I started out as a part of BruinSpace, since it seemed to be a good intersection of physics and CS (I was an undeclared engineering major at the time). I worked on the magnetohydrodynamic pump project and worked on circuitry and design. However I didn't find my calling with BruinSpace. In spring quarter last year I became a part of UCLA DevX as an iOS developer for BruinBite. Due to COVID, this term BruinBite was stalled and currently I'm working as a backend developer in Knovigo, an app for finding safe places to go to during COIVD.","www.linkedin.com/in/abhishekmarda , www.github.com/abhishekmarda",,"More than just solving questions, I'm intrigued by the way that one comes to a solution. I think that ICPC is a great way for me to bring my thought process to the table and modify it with the thoughts of other equally curious individuals, and improve my problem solving skills! I also would love to help others through their solutions; I believe that the best way to master a subject is only when you get to teach it yourself!","My favorite problem is always subject to change, and it's generally the one that my mind is ruminating over. At the moment, partly because I'm taking an algorithms class, partly because I used it in my CS 32 project, and partly because it's so simply brilliant, it has to be Dijkstra's algorithm.",Yes! I used to teach science through experiments to lesser privileged children in my area in a park over the weekends. It's one of the best feelings to teach those who wish to learn; in turn it teaches you too!
10/29/2020 22:55:00,daviddeng8@g.ucla.edu,David Deng,he/him,,Computer Science,No,2023,ICPC,,"I hope to be able to meet a lot more of the awesome people in ACM as an intern. I've learned a lot from ACM events in the past, and I hope that in being an intern I'll be able to not only learn more for myself but also learn more about teaching others.",ICPC Intro to CP,"DevX
Daily Bruin (writer)","I was a developer for Creative Labs last year and had a lot of fun developing an AI Chrome extension with my team. I've also been a part of DevX and Daily Bruin since last year. For DevX I was also a developer, while for Daily Bruin I was a sports contributor, mainly focusing on writing articles about women's volleyball and track and field.","Resume Link:
https://docs.google.com/document/d/1Lg-Jav51gY1LqVF1nKNhDpaXpxQy1Q9yDzq5gUXD04w/edit?usp=sharing",,"I learned a lot from the Interview Track last year, and I'm really enjoying Intro to CP this quarter. I think that teaching about algorithms is something that would help a lot of students at UCLA, especially since we don't have an official ""data structures and algorithms"" course like many other schools do. I know that the problems I did in Interview Track were really helpful for me to learn how to approach LeetCode problems and the such, and I'd like to be able to contribute to the club's efforts. Plus, I remember going to the ICPC booth at the virtual club fair this year and all the officers were super nice and open, so I'd love to get to know more people in the club.","I don't know if this counts, but I love Minesweeper! It's especially fun for me to try playing with different handicaps – for example, no marking mines. I enjoy having a different map of mines every game to solve and trying to do it as fast as possible.",I do some coaching for my high school speech and debate team – and help my 6-year old brother with his math homework.
10/29/2020 23:22:30,vli2002@rocketmail.com,Victor Li,he/him,,Math of Computation,No,2024,"Cyber, ICPC",,"For ICPC, I hope to gain knowledge and skills for solving coding problems by learning from the expertise of others.

For Cyber, I hope to learn more about cybersecurity (especially cryptography) and hopefully have the opportunity to apply what I have learned.",I attend the weekly ICPC Intro to CP workshops and Cyber workshops.,None.,"I haven't been involved in other student organizations at UCLA, but I was the software lead of a high school robotics team and president of my high school's Math Club and Chess Club","Jank resume here: 
https://docs.google.com/document/d/16vcS-SkjHqc1jcQGaiRiwONH_jNeCMoBwdbnKgjTDaI/edit?usp=sharing",,"I really like problem solving, but I've only done math competitions in the past. Other than ICPC teaching generally useful coding skills and techniques, I am also excited about the competition part of ICPC.","I forgot the exact wording and numbers, but it goes something like this: There are 400 integer powers of nine less than 9^A ( A was some number in the thousands) that start with a 1. How many digits does 9^A have?
It's pretty simple, but I thought it was really cool when I first heard it a couple years ago.","I taught basic AMC/AIME math problem solving in high school during a club, and I taught coding as a software lead in robotics. I also coached a middle school science olympiad team once."
10/29/2020 23:47:26,connord2838@gmail.com,Connor Daly,he/him,,Computer Science,No,2023,"ACM Dev Team, AI, ICPC",,"I have learned a lot about interesting fields of computer science from the ACM workshops that I have attended, and I feel that being an intern would allow me to explore these fields even deeper. I want to get experience that I can't in the classroom, and I think that helping with projects or workshops as an intern will be a great experience. I have a solid foundation in programming and I am quick at learning new skills, so I think I would be a valuable addition to ACM.","Last year I went to meetings for Cyber and Studio. This year I have been going to workshops from AI, ICPC and Studio.","Outside of school and the ACM meetings which I would like to continue to attend if I become an intern, I have no other commitments this year.",I was a part of UMSA last year and received mentor ship in majoring in mathematics back before I switched to CS. I also participated in Bruinlabs this past summer.,"LinkedIn: https://www.linkedin.com/in/connor-daly-5a34b119a/
Resume: https://docs.google.com/document/d/1WOkV48-eEP1qZvs7BhsqQSRadqozsIIq1hmf2cIMiA8/edit?usp=sharing",,"This year I started attending some of the ICPC workshops and I found that I really enjoyed the types of problems I was learning about. I tried out Leetcode, and I'm having a lot of fun solving the problems there. I also know that the skills taught by ICPC are very useful in trying to get internships and jobs, and I think that teaching a skill is the best way to truly master it.","My favorite problem is the one where you take roman numerals and need to output the integer value. This a problem on the very first internship coding test that I ever did, and at the time my code was really messy and I ran out of time before I finished. Later, I saw the problem on Leetcode, and I was able to solve it in a much nicer manner than I was attempting the first time, and that felt really good.","I was in Boy Scouts all through middle and high school, and when I was one of the older and more experienced members of the troop I led meetings and taught the younger scouts the things they needed to know to advance in Scouting."
10/30/2020 2:31:50,xuchujun2672@gmail.com,Chujun (Jerry) Xu,he/him,,Computer Science,No,2024,"AI, Cyber, ICPC",,"As a student from a high school with no clubs focused on computer science, I was incredibly amazed at the organization and the accomplishments of ACM at UCLA. As soon as I talked to some officers at the club fair in New Student Orientation, I knew that I wanted to be a part of ACM. The more I learned about ACM, the more I realized that I would love being there. From the people who were so passionate about their interests to the variety of different events, these different aspects of ACM have inspired me to be the best of myself. I hope that as an intern, I am able to not only better myself, but also give back to the expansive community. I know that even in the short four weeks that I have been a part of ACM, I have already learned so much about all different aspects of computer science, from Unity to how to extract data from files to the different time and space complexities.","I have attended a variety of events, such as:
- Game Studio Ludum Dare 47
- Cyber CTF Cybergames and DTCC CTF
- General meetings
- Cyber Workshops
- ICPC Beginner’s track workshops
- AI Beginner’s track
- Hack HTML and CSS Workshop
Even though I wasn’t able to attend some of the other workshops and meetings because of time conflicts, I was still able watch the videos on ACM's Youtube channel.","As of right now, I do not plan on applying for any other club positions at UCLA. I am currently tutoring three middle and high schoolers, which takes around 6.5 hours per week. I have plenty of free time, especially since I am at home for this year. I hope to be able to get an internship or research in the future, but I haven’t looked too much into it yet.","At my high school, I was president of CSF (California Scholarship Federation), the largest community service club there, with over 300 members out of our school size of around 2000. As president, I oversaw the planning of annual events such as Pie Bake, where we got together during the Thanksgiving Break to bake pies to donate to the homeless. In addition, I was vice president of administration for Key Club, another community service club. The year before, as secretary of Key Club, I was able to get a three-state-wide award, distinguished secretary, for an e-portfolio that I will link in the next question on this form. I was captain of the math team at my high school, but in addition to that, I also volunteered to lead the math team for the middle school that feeds into our high school. I was involved in cross-country ever since 6th grade, and I was chosen as varsity captain my senior year.","Resume: https://drive.google.com/file/d/1xxfpZAoy0WA4cCiinxcYLOg7XuUuTDIj/view?usp=sharing
Linkedin: https://www.linkedin.com/in/chujun-jerry-xu-3712331ab/
Distinguished secretary for CNH Key Club e-portfolio: https://issuu.com/jerryxud12e/docs/distinguished_secretary 
Page I wrote about encryption: https://sites.google.com/site/jerryxucosmoscluster6/products-services/encryption?authuser=0",,"I have done a lot of competition math in high school, but not much in terms of competitive programming. However, I think it is my background in competition math that also draws me into ICPC, because of all its similarities. I love the feeling of finally solving a problem that I might have spent hours thinking about, just to see things from a different perspective and spot a solution. I’ve attended the beginner workshops, and I really love the different challenges. In the past, I’ve tried out USACO, and got to silver, but I never found time to regularly do it. I hope that if I am able to be a part of ACM ICPC, I will be able to not only advance my own knowledge, but also give back to the community and share my passion and insights.","(This problem is kinda long and has pictures so I'll include a link to a document)
https://docs.google.com/document/d/1PIhZL4J5JPwDq3fNpL8_yWoXKKn5qLkiibNKpL7j4ew/edit?usp=sharing","Yes! I am currently tutoring three high school and middle schoolers in math, ranging from 7th grade math to math analysis. Last summer, I also tutored someone for SAT. At school, I worked as a math tutor after school, helping people on homework and studying for tests. In terms of groups instead of one on one, I was math team captain my senior year of high school, so I had to teach a class of around 25 high schoolers and 35 middle schoolers with two new weekly powerpoints on competition math topics."
10/30/2020 2:57:06,steven0821@g.ucla.edu,ZIYI YANG,he/him,,Computer Science and Engineering,No,2022,"ACM Dev Team, AI, ICPC",,"Expericence of development and projects, learning new things","AI advanced track and Apply ML, ICPC advanced track",Not yet,"SouLA Acapella, Bass (not really related lol)",resume,"I just switched to CSE this quarter, and in summer I took a ML course online","I want to learn more about how to smartly manipulate different algorithms and data  structures, how to make programs faster and more efficient. Often times solving problems propels me to think more.","My favorite problem is actually quite ancient. The story is in ancient Greece there was a puzzle: how large is the Earth? Archimedes knew that 50 miles away in another city, there is no shadow right at noon. By measuring the length of shadow in his own city, and given the distance between the two cities, he was able to estimate the radius of Earth. The geometry behind is not complicated at all, but I still think the method is really cool. A related problem is to estimate the radius of Earth only from a photo of sunset.","Sort of, but only teaching my peers (mostly basic concepts and homework problems)"
10/30/2020 3:22:26,shreyankcollegeapp@gmail.com,Shreyank Kadadi,he/him,,Computational and Systems Biology,No,2024,"AI, ICPC",,"By being an ACM intern, I hope to gain an extensive knowledge of computer science while also finding a community with like-minded people. In high school, I enjoyed being around people that shared the same passions as me, whether it be computer science, technology, math, or just problem solving in general. I aim to bond with the members of ACM and work with them to better the UCLA community one line of code at a time (yes this was cheesy don’t attack me).",My current involvement so far has been going to the ICPC events and attending the Intro to CP sessions. I aim to attend more events in the future as soon as these dreadful midterms are over!,"My only other active commitment is the UCLA Quizbowl club, giving me lots of free time to focus on ACM (assuming that classes don’t take up too much time).","In high school, I was the president of my school’s quizbowl and FTC Robotics teams, and I was an active member of my school’s PPS (Programming and Problem Solving) and math clubs. Through these clubs, I was not only able to gain experience in the STEM field, but I gained managerial and leadership skills through hosting tournaments, events, fundraisers, and running a club in general. Furthermore through PPS, I led my team at the 2019 Stanford Programming Contest winning second place in the special round.",www.linkedin.com/in/shreyank-kadadi,"I love teaching -- I am a tutor and have taught STEM related things such as coding, chemistry, biology, math for the past five years. I am a huge pokemon fanatic and love to stream minecraft on twitch :)","My favorite moments of high school were going to the math team room after school and learning how to work through problems that I initially thought were impossible. This all culminated in me taking part in the Stanford Programming Contest with my friends -- the euphoric feeling of solving a difficult problem after hours of struggling made it all worth it. Ever since, I have taken an interest in competitive programming and problem solving, becoming an active member of my high school’s PPS (Programming and Problem Solving Club). By becoming a part of ACM ICPC, I want to continue to dive into the world of competitive programming and teach others how great it feels to solve something seemingly impossible.",The Walking Ant Problem!,"Yes, I have been a STEM tutor for the past five years! I also coached various Science Olympiad events at the middle school level."
