10/31/2020 2:14:34,twisha.jai@gmail.com,Twisha Sundararajan,she/her,,Mathematics of Computation,No,2024,"Hack, ICPC",,"I hope that being an ACM intern will help me connect at a higher level with the Computer Science community at UCLA. I would love to stay as involved as possible whether it's learning from my upperclassmen as well as spreading knowledge to those who come after me. At my high school, I was always very involved with the CS community. Apart from my involvement in several clubs, I served as a Computer Science TA where I helped students with their various projects, and I also tutored students in Java and Calculus at the library after school. While I have a strong passion for Computer Science and greatly enjoy teaching, I know I have a lot to learn along the way. In the 3 weeks I have been part of ACM, I have already learned a great deal and have found meetings incredibly engaging and challenging (in the best way:) ). One aspect I really admire about ACM is the level of organization every meeting upholds. Between each committee and the club as a whole, each event is well planned, promoted and synchronous. I am super excited about my upcoming ACM journey, and I know that given this opportunity, I would put in my all to continue learning and take a step closer to being able to give back to the CS community at UCLA.","Over the past three weeks, I have been regularly attending ACM ICPC, ACM Hack and ACM ICPC. In order chronologically, these are the events I have attended so far: Fall General Meeting, ACM AI General Meeting, Beginner Track Workshop, Hackschool Session #1, Intro CP Session 1, AI Workshop #2, Hackschool session #2, Intro CP session #2, AI Workshop #3, Hackschool session #3, and Intro CP session #3.","ACM is currently my first priority in terms of clubs, but apart from ACM, I'm in an a Cappella group.","- In high school, I served as the Head of the debate teams and later the VP of the Speech and Debate club as a whole, where I learned how to manage various spreadsheets regarding membership info, tournament registration, payment/finances, various deadlines, website updates and communications to large groups of people. As part of these roles, I also took on the responsibility of planning an elaborate Speech and Debate summer camp raising over $60k for our club. For this project, I created a detailed curriculum, did heavy promotion to the middle school in our district and handled finances.
- Additionally I served as the President of my high school’s aCappella team, where I planned two large annual concerts. I oversaw all of the details of these events for 2 years, including the promotion of the events, fundraising, and managing the weekly rehearsals. 
- I also served on the board of the National Honors Society Chapter at my high school, where I maintained weekly tutoring points for all of our members and published the information on our website. I also handled communication between our advisors, tutors and officer team, making sure that all events ran smoothly.",https://drive.google.com/file/d/157J0EeS4UMdsDCfnTtk_W38dDkGkwaoI/view?usp=sharing,,"Having attended all of the ICPC meetings so far, I genuinely have learned so much in the past 3 weeks. I find every meeting so engaging and (enjoyably) challenging, and I’m constantly looking forward to the next ICPC meeting every week. Even though I have a lot of room to improve, I genuinely find the thrill of competitive programming like no other. Thanks to the patient and clear guidance of the officers, I think I have already made progress in terms of speed and strategy, and I’m so grateful to have come across this community. I truly enjoy all of ICPC’s meetings, and I hope that as I delve deeper, I can also give back everything I been able to learn.","One of my favorite problems was coming up with an algorithm to create harmonies for any given key and scale. Creating music is one of my favorite hobbies. When I had to opportunity to work with CS and audio technology professors one summer, I decided I wanted to code a real-time harmonizer. For this, I created an algorithm that takes an input of the pitch you sing, and based on the scale and key you select, it identifies which note in the scale you are singing. It then calculated the shift in semi-tones and outputs the relative harmony.","My Junior and Senior year of high school, I tutored high school students in Java, Calculus and Chemistry after school. I also worked as an instructor at a Speech and Debate institute, where I taught students how to give speeches and be confident public speakers. I also volunteered at my local middle school's debate chapter to teach them the intricacies of argument construction. Lastly, I wrote the curriculum for my school Debate summer camp of around 200 students for various skill levels."
10/31/2020 2:36:11,trevorong@ucla.edu,Trevor Ong,he/him,,Computer Science,No,2024,"ACM Dev Team, ICPC, Teach LA",,I hope to become more involved with ACM at UCLA and through being an intern develop and improve my skills as a programmer while also working to solve problems and build ways for more people to connect and learn about computer science. I also want to meet all the cool people at ACM and learn more about all the various branches of computer science that people are passionate about working on or learning about.,"Right now, I’m a member of ACM AI and Teach LA, and part of ACM Hack Fam.",ACM AI & Teach LA,"In HS:
Wind Ensemble and Jazz Band - I played the trumpet and was the section leader for the jazz band. During individual section rehearsals, I helped people out with tricky rhythms and passages.

Math Club (Co-President) - I planned out weekly lesson slides/problem sets and organized contest registration for a club of around 20 members. I also co-taught during meetings and answered questions about the problems we presented.

Tutoring - Over the summer, I helped tutor groups of incoming freshmen in basic math/english skills.",https://docs.google.com/document/d/1wfx3IQhwXAa5m9BgPNXtL2mEfZAnSECPkYV4_0tbke8/edit?usp=sharing,,I want to be a part of ACM ICPC because I enjoy problem solving! Back in HS I was involved with some math/CS contests which were fun to be a part of. I also enjoy being able to help people through teaching and guiding people through problems.,"The first “problem” that came to my mind when I saw this question was this problem about grains of sand. The general idea is that if 100,000 grains of sand is obviously a pile, and 99,999 grains of sand is also a pile, then if you continue to remove a single grain at a time when does the pile of sand stop being a pile? 

A similar question I remembered after the grains of sand question was: “If you would definitely do some task for $100,000 but not for $0, when would the tipping point be? (These are definitely very subjective but I think that the questions themselves are fun)
",I have a little experience with tutoring over the summer for my high school and teaching biweekly lessons for my HS math club but other than that I don’t have much experience teaching large groups of people.
10/31/2020 2:48:00,sumithn@g.ucla.edu,Sumith Nalabolu,he/him,,Computer Science,No,2024,ICPC,,"In just a month, I've already learned a lot from ACM workshops and I've met quite a few great people through them too, so I'd love to get even more involved in ACM. Also, competitive programming is the first area of CS that I know I am passionate about and want to pursue further, and by interning with ICPC I would get to work with and know many others who share this passion with me. I also would like to contribute to others' learning and growth in the UCLA community if I can, and I think helping out with ICPC would be the best way for me to do that.",I have attended a few ICPC and Cyber workshops.,None as of now.,"In high school, I was the president of my school's math club for two years; I was in charge of organizing logistics for contests as well as leading lectures and discussions on math topics in weekly meetings. I also taught several classes to younger students (about math competitions) at the local math circle.",Resume: https://docs.google.com/document/d/1cKQrZLff2jFOiVoOnN45_7LF1t9qiWYnXcCsQ-_BlqQ/edit?usp=sharing,,"In most of middle school and high school, I dedicated a lot of time to math competitions; over time, I came to realize that the best part about these competitions to me was the critical thinking and problem solving aspect, not necessarily the math itself. So as I started exploring CS, I was naturally drawn to competitive programming, seeing as it's pretty similar to math competitions in terms of it basically being about problem solving at its core. I've been excited about participating in ACM ICPC for a while because of this, and I've definitely had a great experience so far both with learning and just meeting others interested in problem solving contests like I am. Since competitive programming will likely stay an important activity to me throughout college, I'd like to be even more involved in the CP community here, which is why I am applying to intern with ICPC.","It's hard for me to pick one favorite problem, but one of them is the following math competition question (2008 USAMO #1): 

Prove that for each positive integer n, there exist pairwise relatively prime integers k0, k1, ..., kn such that k0*k1*...*kn - 1 is the product of two consecutive integers. 

I like this problem (and most of the others are for the same reason) because I enjoyed seeing how several relatively simple concepts came together nicely in my solution to prove an interesting result.",I have past experience teaching competition math at my school's math club and at the local math circle.
10/31/2020 2:58:58,kenny.n.1204@gmail.com,Kenny Ni,he/him,,"Applied Math, Specialization in Computing",Yes,2022,ICPC,,For me I mainly want to learn more about real world applications of computer science. From the handful of coding classes I've taken at UCLA I have only learned the basics of various languages but not really how these languages are actually implemented in the tech industry. Obviously there are countless possible uses of C++ and Python but I just want to learn a couple of the main ones since I would imagine just knowing how to output small programs isn't too useful in the long run.,To be completely honest this is my first year in ACM and I haven't done any events yet because I've been trying to start off strong in some of my more difficult classes (Python) but my desire to get more involved with the organization is what has led me to apply for this internship.,I am currently in the Undergraduate Mathematics Students Association and I do intend to attend some of their math workshops in the coming school year. I also intend to apply for Product Space since it is my ultimate goal post undergrad to enter the product field.,"The most recent student organizations that I have been a part of outside of UCLA were the mathematics club and computer science club at my community college and since I was only a community college student for a single year I could only be an active member in both rather than hold a leadership position. In high school I served as the Secretary in our school's Make a Wish organization and my duties included creating agendas for monthly meetings, keeping our members up to date on all events, and actively participating in fundraisers. I was also the Secretary of my high school's DECA organization and my job revolved around registering members for business competitions and serving as a mentor for said competitions on numerous occasions.",Just my resume: https://drive.google.com/file/d/1oMkXPFc0RmcgP1URheR0HpXZZvzusD1-/view?usp=sharing,"I do have some experience in teaching K-12 when I worked as a teacher's assistant in my senior year of high school, so hopefully that experience will be helpful in some of the committees that I applying for.","My primary reason for applying to ACM ICPC is that my favorite, and truthfully sometimes least favorite, part of computer science and coding is solving complicated problems. There is no better feeling than spending hours or maybe even days on a project and finally seeing the program run successfully for the very first time, and that feeling is pretty universal in regards to solving problems in general and the fact that there is an entire sub-organization that specializes in strengthening people's problem solving skills is exactly why ICPC stood out to me. While my approach to solving problems may be slower or faster than other people, I am very eager to both learn from others and develop my own problem solving skills, as well as to teach others how to solve problems that I am familiar with since I find the processes of learning and teaching to be equally rewarding.","I am a fan of problems where even though the problem may seem complicated, they actually have a pretty simple and straightforward solution. The first problem of this kind that came to mind would have to be the Tower of Hanoi problem. I first learned how to solve the problem in my first winter quarter at UCLA in PIC 10B, and I honestly really like how such a seemingly complicated problem can have such a simple (though somewhat tedious) solution.  I can also appreciate that the solution code also helped me study some of the major topics of the course right before my midterm.","Yes I do! I mentioned in the previous page of questions, that I have some experience in teaching K-12 students when I worked as a Teacher's Assistant during my senior year, and another big part of why I am applying to ICPC is that I really enjoyed my time helping young, bright minds learn new things about various topics or to have the feeling of satisfaction that comes from aiding a student who was seriously struggling in a particular subject, a feeling that I can sympathize with."
10/31/2020 3:00:24,jennycho35@gmail.com,Jenny Cho,She/her,,Linguistics and Computer Science,No,2024,"AI, Hack, ICPC",,I want to explore what computer science offers and see if it is a right career path for me,I attended one ACM event via zoom,"Job, , classes","I was vice president of Science National Honors Society, and I was responsible for suggesting new science topics to discuss with the club every week and making introductory PowerPoints",,I am new to computer science but I am interested in it,I do not have strong technical skills since I'm new to this field. I thought ICPC would be a great resource for me!,Anything related to derivatives!,No
10/31/2020 3:01:44,mattpdl@ucla.edu,Matthew Ponce de Leon,he/him,,CS,No,2023,"Hack, ICPC, Teach LA",,"ACM brings people with passion for computer science together within the UCLA community and beyond. Of the ACM events I've attended, I've very often left with a sense of empowerment and fascination, and I'm glad to have made some friends along the way. As an ACM intern, I want to help evoke those same feelings in those who join us at ACM events, leveraging my passion for teaching and pursuing growth in my leadership and planning skills with a team of ACM officers.","* Attended a variety of events across most committees since Fall 2019 (notably, Hackschool workshops, Fall 2019; Hack on the Hill 2020; ICPC Interview Prep, Winter 2020; Hack Tooling Series, Spring 2020)
* Hack Fam Head (since Oct 2020)
* Teach LA Curriculum Team (helping instruct/moderate Emerson M.S. Python class, since Oct 2020)","* Part-time work (15-20 hr/wk, with flexible scheduling)
* MentorSEAS Mentor","I have no experience with student organizations in college, but in high school, I was an officer and lead delegate for my high school's Model United Nations team. I led a digitalization effort for the team's meeting attendance tracking, helped plan training and social events, assisted with team logistics for conferences attended at other schools, and enjoyed mentoring new members and ease them into their first weekend conference.",LinkedIn: https://linkedin.com/in/mattpdl,,"Perhaps the only thing more interesting than solving problems is pondering how others came up with solutions years or decades before you. I want to challenge myself to further develop my teaching, leadership, and logistical skills the same way I'm challenged by ICPC workshops, and being an ICPC intern would pair my passion with the mentorship of the ICPC team for a strong opportunity for growth.","This isn't exactly a problem, but I'm fond of the principles of game theory. It's even helpful in real life to make difficult decisions when you're not entirely sure of future circumstances.","In addition to my experiences as a summer math tutor and delegate trainer for my high school's Model UN team, I recently joined Teach LA's curriculum team as an instructor/moderator for a middle school Python class. I feel teaching and public speaking are among my greatest strengths, but like everything, there's always room for improvement."
10/31/2020 3:05:47,leonardchen@ucla.edu,Leonard (Lenny) Chen,he/him/his,,Computational & Systems Biology,No,2024,"AI, ICPC",,"I hope to gain a better knowledge of AI and competitive programming and become really immersed in the UCLA computer science community. I want to form valuable friendships and connections within the club, and learn from the brightest and most caring leadership. 
Throughout my internship, I also want to learn how to best organize in and serve an organization much larger than myself. Finally, I hope to gain advice and guidance for how to best navigate the field of computer science at UCLA and beyond. ",I attend ACM AI's beginner Machine Learning class each week and I've been keeping up with ACM ICPC's beginner track on youtube.,"Samahang Modern member, ACA member","I was the co-head of a dance team in high school, and was a member of various STEM teams and clubs throughout high school. The co-head position entailed organizing 1000+ attended dance showcases, choreographing and creating formations for the dance team, and gentle and caring guidance of dance team members. Even when I wasn't in a ""leadership role"", I helped to organize many of the people and activities within clubs and helped newer members become part of the group.",A very rough resume lol pls don't take seriously: https://drive.google.com/file/d/1dE389Wv39TOqNdvT8fS-p13GyZTysLxv/view?usp=sharing,,"I've always been interested in problem solving, stemming all the way back to competitive math and physics beginning early in middle school. Throughout my high school experience, I was able to very effectively use the problem solving skills I developed in competition to make my school life a lot easier. I've never seriously looked into competitive programming or problem solving with computers in mind, but I really want to learn more and get involved in college.",Traveling Salesman,I was a part of my old school's peer tutoring program where I served as a tutor in STEM fields for a couple hours each week. I also taught dance choreography to complete beginners in dance each week.
10/31/2020 4:15:00,nareh@g.ucla.edu,Nareh Agazaryan,she/her + they/them,,Computer Science,No,2024,"Cyber, Hack, ICPC",,"I hope to get experience working behind the scenes with ACM, as well as learning more about (ant teaching) the CS topics that I will be directly involved in while being in a helpful and empowering environment. I would also like to be more involved in the ACM community and better learn how the ACM committee I intern for operates, and give back to the UCLA community that has made my time at UCLA as exciting and fun as it has been so far. All of this together will hopefully not only expand my knowledge but also","I've either gone to or watched asynchronously all of the workshops from the committees that offer workshops, excluding advanced tracks for all committees. I also attempt to be active on the discord when possible!","At this moment in time, ACM is my only commitment outside of school. There is one project under Teach LA that I have been working on with two other freshmen that is ongoing.","Since this is my first quarter at UCLA, I have not been involved in anything at UCLA. However, in high school, I had been in the Associated Student Body (Student Council/Government) since sophomore year. In sophomore year, I was the Class Vice President. Along with working with the Class President and Secretary/Treasurer on class events, I was also in charge of coordinating our class for the biggest class competition of the school year. In junior year, I was executive Treasurer. Treasurer is amongst the top 4 positions in ASB, and therefore I was involved in larger decisions involving ASB as a whole as well as general planning for school events. As Treasurer, I was mainly in charge of communication between the finance department and ASB for budgeting on events, as well as filling out invoices for our purchases. In senior year, I was executive Vice President. I was once again part of the top 4 positions, so I performed those same tasks. In addition, I was in charge of planning and hosting the largest class competition of the year, as well as advising the class officers throughout the process.","Not at the moment, but it's in the works!","I love studying and learning about Computer Science topics. I try to expand my knowledge in my free time and sharing what I learn with my friends who are interested in similar topics. While I do not know much compared to people who have been studying for much longer than me, knowing the abundance of topics I have left to learn is extremely exciting to me. I can't wait to progress throughout this year both in my classes and through ACM to expand my knowledge and become a better computer scientist!","Admittedly, I am quite new to the Competitive Programming scene, but within the past year (in which I have begun to become more serious about learning CS), I've become deeply interested with problem solving. I don't believe computer scientists strictly learn CS to learn to code. Computer scientists are inherently problem solvers, and the code we write are the solutions. Learning about data structures and algorithms that assist in solving these problems is something I have been struck with a desire for. I want to gain to knowledge in order to not only apply these problems in future programs and potentially in competitions, but also to share this knowledge with others and hopefully inspire others to strive to be better problem solvers and find excitement in building excellent code with new-found algorithmic thinking. The ICPC workshops have sparked a huge interest for this field in me and I hope to do the same to others while in the process improving my algorithmic thinking as well.","While I am still exploring all the algorithm problems that CS has to offer, the one that I first heard about that intrigued me is the open P vs. NP problem. I'm not sure if this counts as a problem, per say, since it is still an unsolved problem, but it's extremely intriguing. In essence, the question is whether a problem whose solution is quickly verifiable can also be solved quickly. While P problems can be solved and verified quickly, NP problems can be verified quickly, but the problems have an unknown difficulty. To be in set P means that it runs in polynomial time. NP, which stands for nondeterministic polynomial time, is not immediately assumed to be more ""difficult"". Rather, there is no known polynomial time solution to these problems, if it exists at all. The problem is whether P = NP or P != NP. While problems in P must be in NP, the issue is whether problems in NP can lie in P. This problem has existed for nearly 50 years, and a possible solution to this would have massive effects on multiple fields, including cryptography, game theory, AI, mathematics, and many more.","I have some experience in tutoring in mathematics, specifically algebra."
