Timestamp,Email Address,Full Name,Pronouns,Email,Major,Transfer Student,Graduation Year,What would you like to apply for?,"If you chose Board, which positions below interest you the most (choose up to 2)?",What do you hope to gain from being an ACM intern?,"Describe your current involvement with ACM (i.e. events you've attended. It's ok if you haven't, we just want to know if you've gone to any!)","What other commitments do you have for the year? (clubs, jobs, research, etc.)","What other student organizations have you been involved with in the past, and what role did you play there?","Any links you would like to share with us (website, resume, portfolio, etc.)?",Anything else you would like us to know about you?,Why ACM ICPC?,"What’s your favorite problem? It does not have to be an algorithm, or even CS related!",Do you have any past experience with teaching? (It is not required that you do!)
10/20/2020 3:15:51,stephenrzkelman@g.ucla.edu,Stephen Kelman,he/him,stephenrzkelman@g.ucla.edu,computer science + engineering,No,2024,"Cyber, ICPC, Teach LA",,"I'm hoping that I can get more involved in the branches of ACM that interest me, not only to get more involved in these areas of cs but also to become a part of how these branches are run, and hopefully to offer suggestions and new perspectives on how the branches can improve or expand events, tools, and other offerings to better reach out to/service branch members, ACM, and the general CS-interested community at UCLA. Additionally, I hope to really get to know current board members of these branches as well as other interns like myself, to find a community of people who are truly and deeply passionate about these areas of CS, to learn from them and talk about these kinds of topics with them (but also to hopefully ultimately be friends and also talk about and do other stuff with them too that would be cool).","ACM GM, ACM Cyber GM, Teach LA GM, DTCC CTF (with Cyber), Bloom Dev/Design workshops, ICPC Coding Interview Crash Course, Cyber Forensics workshops, ICPC intro to competitive programming workshop","Bloom, UMSA, Math 101 (i mention it because imo it is more of a club than a class), and occasional tutoring during afternoons/weekends","- Growing Up STEM, Los Alamitos High School -- Club President, previously 4th-5th grade event leader
--Led club in achieving goal of fostering a love for STEM by hosting hands-on science events at local elementary schools, with a focus on underserved/underprivileged neighborhoods, with 200 elementary school students participating in each event on average 
--Increased the number of yearly events from 3 to 7 and recruited more than 50 new volunteers to help at events 
--Collaborated with school principals to promote/plan events, trained board members to prepare experiments to teach and also engage students, and communicated with/managed feedback from students and parents to improve the event experience 
--As event leader, worked directly with kids and volunteers to teach new concepts in accessible ways, or familiar concepts in new ways through experiments and lessons that I designed and planned myself
-Mu Alpha Theta (National Math Honors Society), Los Alamitos High School -- Club President, previously tournament director/team captain
--Managed national honors society status for the club as well as registration and activities for 50+ members 
--Created problem sets to teach new formulas, theorems, and problem solving techniques at team weekly practice sessions ","https://www.linkedin.com/in/stephen-kelman-553199174/    (add me!)
https://tinyurl.com/stephenKelmanResume",not particularly...,"While I haven't officially done a whole lot of competitive programming I was extremely involved in competition math during high school, and from the experience I do have with competitive programming, the basic ideas are the same: you get to know the subject(s), and you gain a level of understanding of these topics that is so fundamental and so basic that (and this is the coolest part) you start to see connections between them and other things that you never would have previously thought to ever be true, and you start to see them pop up, almost obviously like a gut feeling, in what might have before seemed like the strangest places --- i.e. some of those super-random seeming competition problems. I just love the feeling of seeing and making those connections and taking something that seems so complicated and strange and following it through to those clean, awesome solutions that competition problems often tend to have (dirtier/more complicated solutions are cool too; it just feels great to solve these problems in general)","There was one that I saw the other day on leetcode it was something like given an array where all elements are numbers with a pair somewhere in the array, except for one number, return that unique number. As a fiend for clean, simple solutions, I was more than excited when I realized I could just run a bitwise xor through the array.

also some bonuses -- Putnam 2003 A5, with a very nice bijection
and Putnam 2018 A6 -- this is the kind of problem I'm talking about where the best part is seeing the connections and following them through to the end, it's like walking through the dark or a fog except finding your next step is infinitely more interesting and exciting
and Putnam 2019 B4 -- wasn't gonna originally include this, since the solution isn't necessarily super clean or nice or interesting imo, but for some reason it popped into my head when I saw this question and I spent like 20 minutes working backwards from the answer to the problem and digging through scratch paper to find it, so here it is",yes-- I tutor for math fairly regularly and worked as a 4th-5th grade instructor for Growing Up STEM (hopefully y'all are able to see the other parts of my application :/) before I was President
10/20/2020 18:49:40,gabrielx1973@g.ucla.edu,Gabriel Xing,he/him,,Math of Computations,No,2024,ICPC,,"Looking to transfer into computer science major, want mentor to help me through lower division CS classes so I can get As and successfully transfer.","Attended some intro classes, watched a couple youtube videos",none,none,,,looking to use the skills from ACM ICPC and land a job/internship,none,No
10/20/2020 18:55:47,trevorwongalt+ucla@gmail.com,Trevor Wong,he/him,,CS,No,2024,"AI, Cyber, Hack, ICPC",,experience,"went to general meeting, watched icpc video on technical interview. watched hack video on html/css. tried the DTCC CTF with some friends","ucla climbing/working out, classes, aca, and maybe singing in the spring/winter?",2nd tier leadership roles in many clubs,https://docs.google.com/document/d/1HD5qQ3JrpLe17ysNwCLCZrLHquXVb_6UakyizVppGbU/edit?usp=sharing,,ICPC seems like it's more problem solving oriented than the other divisions. Most of the others are creating things and understanding things but ICPC is more in the how can we do this in the best way possible where we can measure exactly how well our solution works.,I like reading riddles then reading the solution to them. It's always fun to reflect on how I was missing the solution or if I was thinking of the wrong answer codomain.,My mom's a teacher and I've helped out in her classroom.
10/20/2020 19:19:48,sanchit1591@g.ucla.edu,Sanchit Agarwal,he/him,,Computer Science,No,2023,"Cyber, Hack, ICPC",,"I am new to the field of Computer Science and I am here because I have a strong passion for creating things from scratch and solving problems. I believe that as an ACM intern not only will I be *practicing* my passion on a daily basis but also I will have the opportunity to learn from the wonderful people of ACM and pass on what I learn to my fellow Bruins (I absolutely love to teach!) . As an ACM intern I hope to make some great friends , learn about new technologies and create some really innovative stuff that can contribute to UCLA and society as a whole. I hope that being an ACM intern my versatility as a programmer will grow immensely and I will gain new perspectives to approach problems (competitive and daily-life) .",I have been following all the events of ICPC and Cyber since the fall GM . I also attended the Fall GM of all the committees .,IEEE Micromouse,"Upsilon Lab -> Computational models in Physics (Role -> Programmer (Using Python to simulate physical phenomenons and predicting results in different physical settings(2D particle collision)))
BruinSpace -> MagnetoHydrodynamic pump (Role -> Studying and researching about the electrodynamics related to the pump, making and designing demo models, mathematical analysis of Flow Rate and efficiency)
BruinLabs -> Full frontend web development and startup simulation (Role -> Lead Programmer and Chief Innovator - Created a fully functioning frontend website called Zapply(More info in resume))",https://www.linkedin.com/in/sanchit1591/,"I am Sanchit Agarwal , a simplistic person and a Science ""hobbyist"" with major interest in Computer Science and Physics . I love coding , understanding the intricacies of Nature , writing poems , cycling and cracking PJs. If I were a programming language my REPL would be *tickle* (T.I.C.L -> Think Innovate Create Loop)
Well I also wan't you to know that I will be really happy to be an ACM intern and I am really looking forward to it(LOL). ","I am interested in ACM ICPC because I am obsessed with problem solving. Ever since I was a kid I have always loved mathematics and I always challenged myself to do the ""extra-credit"" problems . Soon that mathematical interest translated into physics and I challenged myself with University level questions in HighSchool. Today as a CS major I am even more crazy about problem solving and as Nikhil said those green ticks of ""accepted"" pleases me more than anything . I feel that at ICPC I will share this interest and fascination with a bunch of wonderful people from whom I'll get to learn a lot . Solved Problems are like dopamine shots for me and the pleasure is even more when I get to teach what I know . The ""learn and teach"" ideology excites me even more because teaching is something I have always enjoyed a lot and I feel the sense of satisfaction one gets from teaching is unparalled.",The happy ending problem,"Actually I have quite a bit experience of teaching . 
1) I have taught Nischay Children (under-privileged) in my school
2) Over the summer I taught C++ and Introductory Computer Science to two high school students 
3) I have taught Mathematics and Physics practically my entire life to my sister."
10/20/2020 23:11:47,tlau0002@gmail.com,Theodore Lau,he/him,,Computer Science,No,2024,"AI, Design, ICPC",,I hope to gain real-world experience relating to my career goals and fill out my resume/portfolio. I also hope to contribute back to UCLA and establish meaningful relationships with people interested in similar things to me.,"I have attended the general, ICPC, AI, Design, and Studio fall general meetings and stopped by one Studio workshop.","The marching band, and maybe GME","In high school, I have participated in engineering and software development afterschool clubs and SkillsUSA competitions, been secretary in an environmentalism club, and founded my own comics club.",https://drive.google.com/file/d/1Atw1ZDFC89L9gRmRCoxwOr_noZqwyREe/view?usp=sharing,,In order to polish my algorithm and problem solving skills.,"P vs. NP -- since this problem is unsolved, it leaves a certain, tantalizing suspense about the fundamental nature/security/complexity of many other things, from solving sudoku puzzles to reversing the product of two prime numbers.",I have tutored my siblings and cousins on miscellaneous topics before.
10/21/2020 2:52:31,jhui571494@g.ucla.edu,Jonathan Hui,he/him,,Computer Science,No,2021,ICPC,,"After attending the Fall GM, I have to say that you guys blew me away: y'all definitely know what you're doing organizationally, functionally, technically. I think that being an intern will give me a chance to better get to know those really involved at a more-than member level while also providing me opportunities to see how you guys really make it all tick.","I switched into CS this past Spring 2020, so my first ACM experience ever was the Fall GM this year. I checked out the ICPC and AI tables and decided that seeing what the ICPC Interview Prep track had to offer would align with my goals to prepare for technical interviews as well as meeting others in the ACM community with similar goals. There's only been 2 meetings as of this submission including the info session, but I am looking forward to the rest!","Tau Beta Pi
GOC Fellowship
likely interning Winter, potentially Spring as well",#ERROR!,https://jhui.gq,i'm cool,"I really liked Nikhil's spiel about promoting ""algorithmic thinking"" to students. I believe that a strong background in this sort of mindset makes anyone an effective problem solver for everything between planning out their week to solving real-world problems in a professional setting. More specifically, I am leaning towards being involved in the Interview Track group because I think that ACM has a great opportunity to provide solid technical interview-prep skills to students and I'd love to join Bill and the gang to continue making that happen.","What would happen if Pinocchio said, ""my nose is going to grow right now""?","At the college level, just TBP tutoring since it was a requirement for initiation. Before college, I've taught arts/crafts for a VBS camp I volunteered at over my summers. But, the coolest experience I have teaching is volunteering as a Motocross Counselor Assistant over the summer for Iron Horse Country Ranch. Cool stuff."
10/21/2020 17:49:10,ningwang1729@ucla.edu,Ning Wang,he/him,,CSE,No,2024,"ACM Dev Team, Hack, ICPC, Teach LA",,I hope to learn more about computer science and be able to use what I learn to teach others in the future.,"ACM GMs, AI, ICPC, Hack, (Still waiting for ACM Studio...)","CreativeLabs TraceLA, HKN Tutoring","CreativeLabs TraceLA, full-stack web development; HKN, tutoring","https://github.com/NingWang1729/
https://docs.google.com/document/d/1P_8WyVHc9DW7oKimWm6q_9dVFaDAwT5Z-k3ZCO3muy0/edit",Waiting for Sinnoh Remakes,I enjoyed the art of problem solving from math competitions in the past and would like to pursue that same thrill except through computer science this time.,"This was an old problem but a classic one; I love this frog and lily pad question.

https://artofproblemsolving.com/wiki/index.php/2014_AMC_10B_Problems/Problem_25",I volunteered weekly at my former middle school's Mathcounts club.
10/22/2020 1:12:25,huiqinwang@ucla.edu,Huiqin Lisa Wang,she/her/hers,,Computational Systems Biology,No,2024,ICPC,,"Going into the field of computing as a non-CS major is a bit daunting, and I want to make sure that I am at a level-playing field with the other members of the ACM community. Being an ACM intern would allow me to equip myself with the skillset and computing experience for higher level participation into the ICPC competition-aspect and not be overwhelmed with the plethora of information. I enjoy a specific, structured introduction to a club--- and being an intern is that gateway to ACM.",I've only created a member account at the ACM site and I will start going to the events tomorrow!,Field Hockey! Taking care of my brother! Daily Bruin! Nothing much!,"Starting as an outreach intern for the daily bruin, I will mainly focus on compiling a scholarship database and leading the winter recruitment process.","Is it possible to share multiple links?  

professional:   https://www.linkedin.com/in/lisa-wang-302a62178/

non-serious: https://www.reddit.com/r/Unexpected/comments/iyoho5/i_hate_it_when_this_happens/","I have a (small) succulent garden! https://drive.google.com/file/d/1I6THfXvjwJ2xbJh7ZhEfxOQQ70yxs3VE/view?usp=sharing 
Here's a picture of them!","Frankly, I joined ACM without any direction or leaning. However, within a day of signing up for the membership, I found myself watching the Instagram takeover of ACM and was captivated by Nikil's interests and his contributions to ICPC. Soon, the advanced training workshop fully expanded my horizons on what the definition of ""computing"" is: it is an eye-widening one-second moment that comes from hours of practice. I was told to adopt a growth mindset in my LS7A (intro to cell biology) class, and that is to persistently seek discomfort and be eager to reach for more practice. It seems to me that joining the ICPC committee would train me in the art of staying calm in time-sensitive scenarios, to exercise logical interpreting in group settings, and essentially *throw* me a dictionary of new computing vocabulary. Fortunately, I am equally a good thrower and a good receiver--- I have taught middle-school students the basics of machine learning (what is machine learning? What is AI?) and robotics (using arduino). The teaching component of ICPC would fit perfectly with my experience, even though I am a freshman.","My favorite problem would have to come from the electron emission spectrum or atomic emission spectra. It is a direct visual representation of the electron's movement! It literally shows the electron jumping from one level to another and by knowing if it's a Lyman series or Balmer series you would know its starting level and thereby compute its ending level. I really enjoy figuring out a problem by knowing exact steps to approach the problem, and even more if I can see it (well, technically I haven't ever seen a single electron moving, but I can certainly draw a diagram of it)!","Yes! I taught middle school students the fundamentals of robotics (Arduino), data structures, and Ruby afterschool. Explaining the big ideas in Machine learning, Artificial Intelligence, and the emergent technological advances, I have maintained the middle school student's attention for as long as the lecture's duration. I have also created and enforced child-based, hands-on curriculum to promote student interest and receptive learning. 

Although it leans towards more advising than teaching, I can currently advising rising senior students on their college applications and admissions essay by providing University of California application consultation. I revise and provide feedback to students on their personal statements through hour-long 1-on-1 sessions via zoom. I also create blog contents weekly, alongside designing and posting for the Curicular (company name) Instagram page."
10/22/2020 18:33:15,holyun.lucas.jeong@gmail.com,Ho Lyun Jeong,he/him,,CS,No,2024,"ACM Dev Team, ICPC",,"Experience, learning, and sharing","AI beginner workshop, ICPC advanced track, Bloom/hackschool, AI apply ML",None at this moment,"FRC Team, Software head",https://drive.google.com/file/d/1RIv4bVKHDRpF75eQ6cuSn9BY7XaPG3Lz/view?usp=sharing,Can't think of anything other than I get the exact same order every time I go to Chipotle,I've got a lot to learn and I've got a lot to share here.,https://codeforces.com/problemset/problem/938/D (Problem G in Advanced Training Week 1 Contest),"Yes, I've taught Geometry, Algebra, Calculus, Physics, and I gave a lecture on dfs pruning once."
10/26/2020 3:55:40,vinay.liang.shukla@gmail.com,Vinay Shukla,he/him,,Computer Science and Engineering,No,2024,"AI, ICPC",,"Honestly, I just want to be more involved in the clubs that I currently am interested in. A lot of the leaders/officers in my clubs of interest have been extremely welcoming and helpful, and I hope to eventually help give other students a similar experience. For now, however, I want to learn from my officers more especially in AI and ICPC, honing my own skills and expanding my knowledge in both these facets.","I went to the fall GM, the ICPC GM, AI GM, and watched the Hack GM asynchronously. I've also begun Advanced Training for both AI and ICPC while becoming a part of the Dev Team for Teach LA.",I might look for research during the academic year but other than that none really aside from personal projects.,"I have been a part of my schools Math Team as Vice President, the VP of a volunteering organization that performed music at retirement homes, and held positions in my school's Science Bowl Team.","https://docs.google.com/document/d/1FlgH8iLuWnQMcUCc40Mlo_rfF4dYFUJjmV0nS6s0woE/edit?usp=sharing
",,"I just recently got into competitive programming in general, and I am really fascinated with the nuance of the subject. I would like to continuously learn and hone my own skills while exercising my problem solving skills.","I guess I don't really have a favorite problem per say. I do enjoy dynamic programming problems a lot in CP. The harder ones really make me think about them. In math, I think geometry is really fun and can be super impossible. Also, algebraic problems with cool observations are quite neat.","I don't have much official experience, but I really like helping people understand difficult problems. Seeing them come to a certain realization brings me happiness as well."
10/26/2020 17:29:59,agrimgupta@ucla.edu,Agrim Gupta,he/him/his,,Linguistics and CS + Stats Minor,No,2023,"ACM Board, ACM Dev Team, AI, ICPC",External Affairs,"1. Make meaningful connections, and find people with similar interests. Currently, I have very few friends who study CS, since I only recently decided to major in it.
2. I really love how cleanly the club is structured. I want to get to know the operations of the club better, so I can contribute to it. I am especially interested in the moonshot initiatives like ACM Impact and want to be able to have an impact on such newer organisations. 
3. I hope that gaining insight into the inner workings of the club would majorly bring about similar efficiency to my lifestyle.","I attended around 5 weeks of the beginner ACM ICPC track workshops last quarter. I am currently attending the Applied ML workshop series as well the coding interview prep series from ACM ICPC.

Additionally, I went to the Facebook office in LA last quarter and had a really good time with other students involved with ACM.",I am working as a Data Blog Lead for a data science community on campus called DataRes,"[Repeat] I am working as a Data Blog Lead for a data science community on campus called DataRes.
Here's a summary of some of my responsibilities:
Logistics:
    - Setting agendas and regular updates with your team
        - Making sure everyone is engaged and on task (has tasks that they’re interested in at the appropriate skill level)
    - Check-ins with Data Blog head (call every 2-ish weeks and/or regular communication on Slack)
Article Creation and Publication:
    - Facilitate publishing 1 article per quarter
        - Teams assigned by skill level and time commitment
        - Collectively choose topics within the team
        - Developing questions to investigate with data analysis",https://www.docdroid.net/k63JIpw/agrim-resume-pdf,,"Because of the keen focus on problem solving. It is never boring at ICPC meetings, because my brain is stimulated 24x7. Moreover, most of what is done and discussed in ICPC forms the fundamental of software applications. Learning to work on those problems in an efficient manner is excellent for a solid career in CS!","I find problems related to the Flood fill algorithm really interesting. In CS32, prof Smallberg asked us to move a video game enemy recursively and after extensive internet research I came across the flood fill algorithm. That is my favourite problem, because it was super challenging to me and it was one of the first times that I actually applied an algorithm to an actual project! It will always remain in my memory.",Informal experience. I am the oldest of 6 siblings and have been guiding my siblings through their schoolwork all my life.
10/26/2020 19:26:58,m.miraftab@yahoo.com,Mona Miraftab,She/her/hers,,Undecided College of Letters and Sciences,No,2023,"Design, ICPC, Teach LA",,I hope to gain computer science knowledge/development that I wish I received earlier in my life. Not being in the School of Engineering at UCLA limited me from choosing computer science as my major so I hope to use ACM as a way to get into programming.,"I have attended the ACM general meeting, the ACM design general meeting, and AI beginner track course!",I am part of the Academic Mentorship and Professional Development board at UCLA and currently seeking for research opportunities.,"I haven't had many opportunities at UCLA to be involved with student organizations, but in high school, I was part of the Board of my school district as a student representative and president of multiple school clubs. Being representative of the district made me look at the school population as a whole and how to speak up for minorities within our school. I had to attend board meetings and gave reports of improvement or recommendations for future action items.",file:///C:/Users/amira/Downloads/Resume_2020.pdf,I am very artistic and do paintings in my free time!,I hope I can be quicker at problem solving in every aspect of my life.,"I personally love solving murder-mystery problems, not really sure that's relevant but hey close enough.",I have tutoring experience with MAPS at UCLA where I help mentor/tutor high schoolers and middle schoolers in underrepresented communities.
