10/27/2020 4:31:50,jacksonadewitt@gmail.com,Jackson DeWitt,he/him,,Computer Science,No,2023,"Cyber, Hack, ICPC",,"Outside of computer science clubs, I have found it difficult to meet other CS majors/enthusiasts who share the same excitement about the field that I do. I have worked on personal projects on my own, but it has been challenging, and I have often failed, to continually set aside time for them when I do not have a community around me with a common goal. As an ACM intern, I would have the opportunity to learn from upperclassmen, teach the next generation of software engineers, and work alongside my peers to explore new topics and ideas in computer science. In this environment, I would not only have the chance to develop my own understanding, but also to pursue my interest in teaching and pass on this knowledge to others.","Last year, I attended the Cyber beginner track and the AI beginner and advanced tracks. This year, I am in the ICPC interview prep workshop and will be checking out the ICPC advanced track.","Recently, I have done some basic development for my friend's website for his tutoring start-up company, and I am looking to further this commitment as he plans to expand his business.","I haven't held a significant role in any student organizations before, though I played sports all throughout high school. As a captain of the lacrosse team for two years and as a starter in soccer, I learned the challenges of leadership, primarily in motivating the team and fostering an environment of unity and cooperation.","Resume: https://drive.google.com/file/d/1IwOrqaTT37bSP2Uhc8XPphytnL6owmp_/view?usp=sharing
GitHub: https://github.com/jad18","I'm from Pittsburgh, so I'm a big Steelers (6-0!) and Penguins fan, and Heinz ketchup is the only acceptable brand.","Out of all of the CS that I have done, my biggest struggle has been with problem solving. I can understand low-level logic and high-level project structure, but I am at a loss for which algorithms to use to solve problems. Because these can be incredibly important for building efficient, robust code, I decided that I should tackle my largest weakness and develop my problem-solving skills. ICPC will give me the opportunity to see new problems and gain an intuition about how to get started and work towards devising solutions. Then, as an intern, I want to turn around and teach others what I have just learned so that they can have the same fun and excitement I do when I solve these problems.","My favorite problem is a whack-a-mole question that goes along the lines of:

You are playing a whack-a-mole game with a 1D row of mole holes, which can either have a mole up in it or not. This is represented by an array of boolean values. You hit them with a hammer of width n, capable of hitting n moles in a row. Write a program that returns the maximum number of moles that you can knock with a single hit of the hammer.

It's my favorite because I remember the excitement of when I was able to figure out the O(N) solution quickly, which I rarely had done before. (My answer was to make a parallel array that would track the number of moles you would hit if that index were the leftmost index of the hammer, using a linear scan through the mole array. Then, you can find the maximum value of the second array.) I love the feeling of solving a challenge, and I remembered this one vividly.","I was a math tutor at a tutoring center for a summer, and I was a personal tutor for three years in different subjects in high school. I also taught Java to middle schoolers during an online CS workshop this past June."
10/27/2020 22:32:45,dyundai1@g.ucla.edu,Daniel Shim,he/him,,undeclared engineering,No,2024,"ACM Dev Team, ICPC",,"Experience in handling responsibility, outreach to ACM members and to get closer with them, and a single commitment to hopefully take position as an officer.","Bloom hack and design, ACM AI beginner track, ACM ICPC beginner track and interview prep.",none so far,"In my high school, I was the Math Club’s President",https://www.linkedin.com/in/daniel-shim-b642771b9/,"I plan to declare Comp Sci and Engineering as my major. Also, I have a resume that is more complete than my LinkedIn profile.","I love the AMC competition, so my discovery of a competitively driven exam in a field that aligns with my interests excites me because I can learn so much. Also, I feel so incompetent in coding compared to the rest of the club that I am dissatisfied with myself, so I am focused and set my sights on becoming a proficient programmer.",Monty Hall,"Yes, as a tutor for YLOC (a volunteer organization), my school’s after-school tutoring club, and for a student I teach on my own time."
10/28/2020 4:55:24,ksj1602@ucla.edu,Kshitij Jhunjhunwala,he/him,,Computer Science,No,2022,"Cyber, ICPC",,"The biggest thing I hope to gain from being an ACM intern is being involved and working with a community where I can contribute with my passion for Computer Science.
I am a sophomore and throughout my first year I've been to many ACM events and seeing the enthusiasm, willingness and helpful nature of the people hosting them, I feel very motivated to be a part of this great organization.
ACM has helped me grow in so many different ways and now I feel like I want to contribute whatever I can with what I've learned while continuing to grow.
I also hope to learn a lot of new skills, meet a lot of great new people and have a lot of fun!","My current involvement in ACM has mainly been with the Cyber and ICPC committee events.
I've kept up with the Forensics Workshops put up by Cyber and the Advanced Track and Coding Interview Workshops put up by ICPC this quarter.
My aim is to learn more about AI/ML too, so I plan to follow the ML workshops by AI soon.","As of now, none.","I was involved with BruinLabs (A Bruin Entrepreneurs x ACM x DevX collaboration) over Summer 2020.
I was Director of Engineering on my team, leading the development of our MVP (which was a product website frontend).
Link: https://zapply-web.github.io","My GitHub: https://github.com/ksj1602
My resumé: https://tinyurl.com/y2zz666g","Right now, I am in another timezone, so have found it difficult to attend ACM events live for Spring/Summer/Fall 2020.
I've followed along with the recordings. Thanks a ton for making them available on YouTube!","Because there's nothing like hitting 'Submit' and passing all the test cases.
But more than that, the process of breaking down the problem, getting to the heart of it and then coming up with an efficient algorithmic solution is what makes the whole thing truly great.
I've been to ICPC's workshops and have learned a lot from them, and have greatly added to my competitive programming experience from high school.
I have a deep passion for problem solving and want to contribute my knowledge while also learning and developing as many more algorithmic skills as I can.
I also wish to get more people involved in problem solving and I want to help ICPC achieve its mission ""To promote algorithmic thinking and help build proficient problem solvers.""
(Btw, among all the committees, ICPC has the shortest (but still complete and clear) mission statement. Being efficient here too I see. )","This is one of the most interesting problems I encountered when I was in high school:

Q: You are on a small boat, isolated in the middle of the ocean. The only way you can save yourself is by throwing two flares in the sky exactly 45 minutes apart. You only have two flares (which cannot be used for anything other than throwing), so you want to be smart about how you use them. To help you measure time, you have a lighter and two irregularly shaped ropes which you may burn. You know that each rope takes exactly 60 minutes to completely burn. Assuming that the time taken to light the ropes/flares and throwing them does not count, how will you time the 45 minutes? (There is no way to know how much time has elapsed by looking at the ropes since they are completely irregular and assume that after spending so many days out in the ocean, your sense of time has degraded from bad to extremely poor).

Solution (Spoiler):
Light the first rope from both ends and the second rope from one end. At this time throw the first flare into the sky.
When the first rope completely finishes burning, you have completed 30 minutes. At this point, immediately light the other end of the second rope. The second rope must have burned half its time (30 minutes) already and now burning from both ends will completely burn out in another 15 minutes. At this point in time, you have successfully timed 45 minutes, so toss the second flare into the sky!",I was Founder and President of the Computer Science Club at my high school and have taught basic programming/binary number system to middle school and high school students.
10/28/2020 20:09:49,ajwalburg@gmail.com,Alex Walburg,he/him/his,,Computer Science and Engineering,No,2024,"Cyber, Hack, ICPC",,"Practical leadership, programming, and operations exerpeince.","I've currently only been able to attend the cyber workshops, but hope to attend more as I get used to campus life.",I am a member of ASC and tutor at LATM,"In high school, I co-founded and was president of Common Good Tutors, a free tutoring service run by students for students. Though it started as a club, we were actually able to make it an official school-run service. I managed the website, assisted in recruitment of tutors, and was the most active tutor for every year I was in the program.

Additionally, I was heavily involved in my high school's speech and debate team. I was the captain of spontaneous speech, meaning I was in charge of writing topics, teaching new speakers, and managing the teams access to resources during prep. I also created and independently ran weekly unofficial preparation sessions to make sure the spontaneous team was ready for competition.
","Common Good Tutor's official website:
commongoodtutors.org","I'm a hobbyist programmer, and have written a variety of applications in anything from Dart to assembly.","I have always loved solving difficult problems, but breaking into competitive problem solving spheres was difficult at my high school as we had no math Olympiad or competitive programming. I see this as an opportunity to break into an organization which has always interested me.","My favorite problem is a follows: Is there a way to map every value in the real numbers to the natural numbers? I personally love this problem because of a personal experience. Understanding why this mapping doesn't exist and what that said about infinity had always baffled me until I was reading James Munkres's ""Topology"" that it all made sense to me. 

This is because the proof of the mapping's nonexistence relied on the properties of the two spaces. The fact that for any two real numbers there exists a number that is in between these two numbers makes the mapping impossible. You could just choose a new number that was in between the points f(n) and f(n+1).

This taught me that the solution to problem solving is to never do more work than one has to. Find the exact minimum properties needed and only prove those. This valuable insight has greatly helped me both in math and life. But I hope to gain many more from ICPC","I am the previous co-founder and president of Common Good Tutors, a tutoring group at my high school that offered free tutoring for students in need. As a result, I have hundreds of hours of tutoring experience in math, chemistry, biology, and computer science."
10/29/2020 0:45:40,pranavpata2@gmail.com,Pranav Pata,he/him,,Computer Science and Engineering,No,2024,"ACM Dev Team, ICPC",,"After attending the fall general meeting as a freshman, I immediately knew that I wanted ACM to be a part of my entire college experience. Not only do I want to grow academically and professionally, I want to grow as a person, develop my leadership skills, build a strong network of like-minded individuals, and be a part of the amazing community that is ACM. I want to learn and grow from the club’s activities, and eventually be an officer that not only gives back to this community, but also strives to expand and enrich the club’s experience. I know that becoming an ACM Intern will be a big step in the right direction for me to get closer to achieving those goals, while also having a great college experience.","Currently, I am regularly attending ACM Studio’s Advanced Unity and ACM ICPC’s Coding Interview Crash Course workshops. I also plan to attend ICPC’s Advanced Workshop to supplement the competitive programming experience I already have. I should have already gone to those meetings, but I was busy at those times, so I am catching up through the recorded videos.","In the winter and spring quarters, ACM Studio forms groups that create a fully functional video game project, and I plan to be a part of one of those groups. I might also try to find a professor to do research with, but I do not have a position right now. Otherwise, I have no other major commitments, so I will have plenty of time to focus on my work as an ACM Intern.","In highschool, I was a Link Leader through a mentorship program called Link where I acted as an upperclassmen buddy to incoming freshmen to support them and make them feel welcome. I also have a lot of experience tutoring, but specifically in the Study Buddy Society, which paired a student with a tutor/mentor to focus on providing academic support, but also emotional support when necessary. From this, I have learned how to interact well with my younger peers, while also gaining tutoring experience that I hope to use in my time as an ACM Intern and beyond. I also played two sports in high school, basketball and track and field, and the most important lesson I learned was that everyone around you does better when they are having fun doing what they do with people that they enjoy spending time with. Whether it is a team sport or a group project, everyone performs better when they are enjoying the experience in a collaborative environment. Based on what I have seen so far, ACM has this wonderful, supportive environment, and I want to be a part of that and continue to cultivate an enjoyable experience for myself and for the people around me.",https://docs.google.com/document/d/1V7DXFmuJImRDSZNwb7S3ZWdmmxeAaMsxhn4mny7FsqA/edit?usp=sharing,I’m looking forward to this experience!,"ACM ICPC in particular is exactly what I am looking for from a CS club because I love competitive programming and creative problem solving. I have been doing competitive programming since early high school and I have always found it to be something fun, yet also productive at the same time. When I first learned how to code, I was amazed at the nearly endless possibilities you could create and the total control you had as a programmer. Honestly, finding simple, elegant solutions to difficult problems through programming is truly beautiful. I already have some experience, I am a USACO Gold member, but I want to continue my competitive programming pursuits, and I know that ACM ICPC is the place to cultivate my passion. At the same time, I want to also give back to the club by teaching and advancing the club in the future, as an officer. Most importantly, I want to meet a lot of like-minded individuals like myself and form a strong community and network. Being an ACM ICPC Intern will be my first step in achieving these goals.","My favorite problem is having too much time on my hands because, while I feel unproductive, I am able to relax and really do whatever I want! Hopefully, being an ACM ICPC Intern will help me with that “problem”! However, my favorite algorithm is binary search. While relatively simple, binary search is a perfect example of that simple, elegant solution to a difficult problem that I mentioned earlier. It was one of the first algorithms that I was taught, and I found that it immediately, intuitively made sense to me and made the “complex” problem of quickly finding a specific number in a large array seem much simpler once the solution was made apparent. Now, binary search is not that complex to me, but learning about binary search was a foundational concept to me because it showed me that there is always a relatively simple solution to a complex problem; I just have to think creatively and analyze patterns to solve it.","I had a job at TheCoderSchool for a short while where I oversaw and helped teach a class of about 10 younger students how to code with the help of an online platform. I privately tutored kids in my community on math and computer science to help them succeed in their classes. I was also a mentor through a program called the Study Buddy Society in my highschool, which paired me with a student who I also helped tutor in both math and computer science. I have been teaching/tutoring for a couple years now and feel very comfortable not only expressing my ideas, but also constantly re-explaining the material in new, easier ways if necessary. I try to be relatable to the kids I teach, since most of them are only a couple years younger than me, so that they are comfortable asking questions and actually engaging in the session."
10/29/2020 2:02:18,sanjitd@ucla.edu,Sanjit Dandapanthula,he/him,,Applied Mathematics,No,2024,"ACM Board, ICPC","External Affairs, Operations",I hope to be able to help spread appreciation for problem solving and computer science for its own sake. I'm also hoping to work with like-minded people and make some friends at ACM.,I've attended the ACM general meetings and I've been attending ACM ICPC's beginner track workshop sessions.,I'm involved with UNICEF Club and the undergraduate mathematics association at UCLA.,"I'm a freshman at UCLA, but in high school I was heavily involved with the FRC robotics club as the strategy head and I also worked on planning and instructing Julia Robinson math festivals at the University of Washington's Seattle campus.",https://www.linkedin.com/in/sanjitd/,I'm excited for the opportunity to see how ACM works from the inside and help out!,I'm a math major and I love problem solving. I joined ACM not because of its software development offerings but because I wanted to think through tough problems and make friends with people who enjoy solving abstract problems like I do. That's what made ICPC appealing for me and I hope that through this program I'll get to engage with ICPC more frequently!,"This is a tough one but my favorite problem is the Josephus problem (people standing in a circle and iteratively killing each other off). It was the first problem that got me interested in doing mathematics for its own sake, and therefore that one is a bit nostalgic for me.",I've taught at the Julia Robinson mathematics festival at the University of Washington and wrote some unorthodox problem sets / developed a curriculum for those events. I also taught some Vedic mathematics at my local ISKCON temple and have had long-term tutoring jobs working with younger children.
10/29/2020 2:20:14,eric8yang@gmail.com,Eric Yang,He/him,,Computer Science,No,2024,"AI, Hack, ICPC",,"Seeing how ACM has presented me with so many events in the past few weeks, I want to pay it forward by becoming an ACM intern and helping to arrange events. This way, future students interested in CS will have the same if not better opportunities than those that I have. Taking upon a leadership role in such a massive organization will also prove to me how small efforts add up to support this larger entity.
Besides building upon the existing organization, I’d love to meet upperclassmen and peers who will be my mentors and teammates respectively. Especially in this online format, there haven’t been many opportunities for me to truly connect with individuals, but after seeing the ACM community, I know that this is the place where I want to be. I hope that the connections I establish will prove to be meaningful once we are all on campus working together.","Currently, I’m participating in the ACM Hack + Creative Labs Bloom Fellowship as a developer. Additionally, I’m competing weekly in the intro to competitive programming track, following the beginner AI track, and (due to a time conflict) watching the ICPC interview prep series on Youtube.",I am an organizer on the LA Hacks team.,"At Silicon Valley Youth, a local non-profit, I began teaching CS to middle school students. As I built up teaching experience through 5 semesters and served as various officer positions, I eventually worked my way up to co-president of the organization. During my year long term, I oversaw a staff of 50 student teachers raising over $15,000 in net profit per semester. I also coordinated with the Ravenswood City School District and Franklin McKinley School District to fund their holiday gift drives and summer leadership conference respectively.
I’ve been an organizer on various hackathon teams serving in positions ranging from operations to sponsorships. As a Director of Sponsorships, I mentored 5 other peers as we reached out to companies in the area inquiring about funding and venue possibilities. The teams that I led raised thousands of dollars to fund hackathon expenses. As someone working on the operations team, I coordinated workshops and activities where hackers could both learn technical knowledge and engage with the larger hackathon community.",https://www.linkedin.com/in/eric8yang/,,"Since the days of hunting for Easter eggs as an infant, I’ve been competitive out of the womb. Throughout school, I always found myself involved with competitions, whether it be Math Olympiad, hackathons, or even USACO. When it comes to training for events throughout the year, ICPC appeals heavily to the side of me that’s always looking for a competition.
On top of just competing, I’ve also had an appreciation for the beauty of algorithms. Specifically, seeing a cleanly presented solution to a problem is always extremely satisfying to me, and I’m inclined to learn that formula. Since I’m currently not taking a computer science class, ICPC provides me with my fair share of algorithms.
Of course, I wouldn’t have any of the knowledge I currently have (both in CS and beyond) if it weren’t for amazing teachers and mentors. Thus, I’m always looking for ways to pay it forward by teaching myself. Seeing the ICPC officers dedicate their time each week towards teaching a range of skill levels makes me want to continue that legacy and mentor newer students getting into competitive programming or just CS as a whole.","My favorite problem would have to be printing out the nth Fibonacci number. This problem seemed so simple to me when I was just starting out CS; just write a recursive function and you’re done right? Wrong! After seeing the stack overflow because of too many recursive calls, I was taught to store intermediate values along the way, which instantly streamlined the solution. Yet even then, another solution would be to calculate from bottom-up, saving memory from stored intermediate values. I was reminded of the subtle complexities of this problem when recently exposed to the similar problem of distinct ways to climb n steps at the ICPC Coding Interview Crash Course. This prompted me to continue thinking about what type of problems I could reduce down to a sequence as such, hopefully netting me a solution or two in future interviews.","Starting freshman year of high school, I began teaching Java for Silicon Valley Youth, a local non-profit. I created my own syllabus and adjusted it according to the other levels of CS taught at SVY. Every semester, I ran classes for around 15 middle school students covering basic topics like variables all the way up to recursion. While students came in at varying levels, I was able to gear the class specifically towards each student by providing both easy and challenge problems. Through balancing class concepts, I made sure that by the end of my class, students would leave as competent coders."
